{
  "format": "agent-company.ios-platform-knowledge/v0.1",
  "platform": "iOS and iPadOS",
  "owner_role": "design",
  "reviewed_at": "2026-08-11",
  "runtime_contract": {
    "reference_id": "current-source:design:ios-platform-knowledge",
    "layer": "current_source_set",
    "materialization": "parent_issued_runtime_reference_set",
    "freshness_mode": "revalidate_before_use",
    "automatic_selection": false,
    "activation_claim": "source_available_not_managed_active"
  },
  "application_flow": [
    "official_source",
    "application_context",
    "product_decision",
    "implementation_token_or_pattern",
    "matching_surface_verification"
  ],
  "layers": [
    {
      "id": "global_design_os",
      "canonical_owner": "Agent Company Design Role Kernel",
      "contains": ["stable design philosophy", "judgment questions", "role authority", "verification invariants"],
      "excludes": ["volatile OS facts", "app tokens and numeric values", "selected app exceptions"],
      "input_to_next_layer": ["decision frame", "authority boundary", "evidence bar"],
      "update_authority": ["Design proposes", "Development changes tracked source", "QA or Seungjeongwon independently verifies", "authorized decision governs activation"]
    },
    {
      "id": "ios_platform_knowledge",
      "canonical_owner": "Agent Company Design role curates Apple-owned platform facts",
      "contains": ["current official sources", "contextual interpretations", "applicability", "exceptions", "strength", "conflicts", "revalidation triggers"],
      "excludes": ["app intent", "exact app token values", "dependency approval", "context-free universal rules"],
      "input_to_next_layer": ["applicable guidance IDs", "decision questions", "required local decisions", "matching-surface checks"],
      "update_authority": ["Design and JangYeongsil recheck primary evidence", "Sejong admits the source for a job", "schema and regression checks gate source changes"]
    },
    {
      "id": "app_local_contract",
      "canonical_owner": "Named app and product decision owners in the target repository",
      "contains": ["exact tokens and values", "chosen exceptions", "implementation references", "candidate and oracle", "visual QA completion evidence"],
      "excludes": ["silent global overrides", "unsanitized cross-app generalization", "claims that redefine Apple guidance"],
      "input_to_next_layer": ["bounded Development handoff", "exact candidate verification oracle", "release-risk evidence"],
      "update_authority": ["Named product or Design owner approves intent and exceptions", "Development owns implementation", "QA owns disposition"]
    }
  ],
  "source_policy": {
    "authority": "official_apple_primary",
    "claim_policy": "paraphrase_and_separate_source_basis_from_interpretation",
    "review_interval_days": 90,
    "recheck_before_material_decision": true,
    "freshness_limit": "A recorded check proves only the local snapshot; it does not prove that the live page remains unchanged."
  },
  "sources": [
    {
      "id": "apple-design-principles-hig",
      "title": "Design principles",
      "url": "https://developer.apple.com/design/human-interface-guidelines/design-principles",
      "authority_class": "canonical",
      "checked_at": "2026-08-11",
      "version_marker": "HIG change log: June 8, 2026, design principles reintroduced",
      "platform_scope": ["Apple platforms"],
      "source_claims": ["Principles are tools for weighing competing priorities rather than one mechanically correct recipe."],
      "allowed_use": "contextual_design_decision_support",
      "recheck_triggers": ["HIG change log advances", "a platform-specific source conflicts", "the product context changes materially"]
    },
    {
      "id": "apple-buttons-hig",
      "title": "Buttons",
      "url": "https://developer.apple.com/design/human-interface-guidelines/buttons",
      "authority_class": "canonical",
      "checked_at": "2026-08-11",
      "version_marker": "HIG change log: December 16, 2025; style and content guidance updated June 9, 2025",
      "platform_scope": ["iOS", "iPadOS", "Apple platforms"],
      "source_claims": ["A general button hit region is at least 44 by 44 points on touch platforms.", "Buttons that form one choice set should use consistent size and style-based prominence rather than size-based priority."],
      "allowed_use": "contextual_design_decision_support",
      "recheck_triggers": ["Buttons change log advances", "target platform is not iOS or iPadOS", "a system component defines different behavior"]
    },
    {
      "id": "apple-accessibility-hig",
      "title": "Accessibility",
      "url": "https://developer.apple.com/design/human-interface-guidelines/accessibility",
      "authority_class": "canonical",
      "checked_at": "2026-08-11",
      "version_marker": "HIG change log: June 9, 2025",
      "platform_scope": ["iOS", "iPadOS", "Apple platforms"],
      "source_claims": ["iOS and iPadOS list 44 by 44 points as the default control size and 28 by 28 points as a minimum control size.", "Control spacing and alternate input or accessibility behavior are part of usability."],
      "allowed_use": "contextual_design_decision_support",
      "recheck_triggers": ["Accessibility change log advances", "the control or input method changes", "an exception below the default is proposed"]
    },
    {
      "id": "apple-layout-hig",
      "title": "Layout",
      "url": "https://developer.apple.com/design/human-interface-guidelines/layout",
      "authority_class": "canonical",
      "checked_at": "2026-08-11",
      "version_marker": "HIG change log: September 9, 2025",
      "platform_scope": ["iOS", "iPadOS", "Apple platforms"],
      "source_claims": ["Adaptive layouts use system safe areas, margins, and guides.", "iOS generally avoids edge-to-edge buttons unless their geometry deliberately harmonizes with the device and adjacent safe areas."],
      "allowed_use": "contextual_design_decision_support",
      "recheck_triggers": ["Layout change log advances", "target device geometry changes", "full-bleed or immersive presentation is proposed"]
    },
    {
      "id": "apple-sheets-hig",
      "title": "Sheets",
      "url": "https://developer.apple.com/design/human-interface-guidelines/sheets",
      "authority_class": "canonical",
      "checked_at": "2026-08-11",
      "version_marker": "HIG change log: March 24, 2026, button placement guidance updated",
      "platform_scope": ["iOS", "iPadOS", "Apple platforms"],
      "source_claims": ["A sheet supports a scoped task closely related to the current context.", "Resizable sheets can use a top-edge grabber and detents."],
      "allowed_use": "contextual_design_decision_support",
      "recheck_triggers": ["Sheets change log advances", "the task becomes navigation rather than a scoped interruption", "presentation style or detents change"]
    },
    {
      "id": "apple-swiftui-presentation",
      "title": "SwiftUI presentation modifiers",
      "url": "https://developer.apple.com/documentation/swiftui/view-presentation",
      "authority_class": "canonical",
      "checked_at": "2026-08-11",
      "version_marker": "Live API documentation checked 2026-08-11",
      "platform_scope": ["SwiftUI", "iOS", "iPadOS"],
      "source_claims": ["SwiftUI exposes presentation detents and drag-indicator visibility for sheets.", "The API documentation does not prescribe one numeric content inset below the drag indicator."],
      "allowed_use": "contextual_design_decision_support",
      "recheck_triggers": ["Target SDK changes", "presentation APIs change", "a numeric top-spacing claim is proposed"]
    },
    {
      "id": "apple-typography-hig",
      "title": "Typography",
      "url": "https://developer.apple.com/design/human-interface-guidelines/typography",
      "authority_class": "canonical",
      "checked_at": "2026-08-11",
      "version_marker": "HIG change log: December 16, 2025; Dynamic Type guidance expanded March 7, 2025",
      "platform_scope": ["iOS", "iPadOS", "Apple platforms"],
      "source_claims": ["System text styles support Dynamic Type and larger accessibility sizes.", "Layouts should adapt across text sizes, minimize truncation, and preserve hierarchy."],
      "allowed_use": "contextual_design_decision_support",
      "recheck_triggers": ["Typography change log advances", "custom fonts or fixed frames are introduced", "content or locale length changes"]
    },
    {
      "id": "apple-swiftui-dynamic-type-size",
      "title": "SwiftUI dynamicTypeSize",
      "url": "https://developer.apple.com/documentation/swiftui/environmentvalues/dynamictypesize",
      "authority_class": "canonical",
      "checked_at": "2026-08-11",
      "version_marker": "Live API documentation checked 2026-08-11",
      "platform_scope": ["SwiftUI", "iOS", "iPadOS"],
      "source_claims": ["SwiftUI exposes the current Dynamic Type size through the environment."],
      "allowed_use": "contextual_design_decision_support",
      "recheck_triggers": ["Target SDK changes", "Dynamic Type APIs change", "a custom text-scaling mechanism is proposed"]
    }
  ],
  "guidance": [
    {
      "id": "ios-touch-interaction-region",
      "title": "Prefer a 44 by 44 point interaction region for ordinary buttons",
      "strength": "recommended",
      "source_ids": ["apple-buttons-hig", "apple-accessibility-hig"],
      "official_basis": ["Buttons gives a 44 by 44 point general hit-region baseline.", "Accessibility distinguishes the 44 by 44 default control size from a 28 by 28 minimum."],
      "interpretation": "Treat 44 by 44 points as the ordinary interaction-region baseline, not as an unconditional visible-frame size for every system control.",
      "application_conditions": ["A person activates an ordinary iOS or iPadOS control by touch or another pointing input."],